{
  "schema": "fb.journey/1",
  "id": "store-journey",
  "version": "1.2.0",
  "label": "Store journey",
  "meta": {
    "source": "context/control-tower/CONTROL_TOWER_JOURNEY.md (proposal, 15 Oct 2026)",
    "facts": "assets/ct/journey-facts.js",
    "note": "Types and payloads are read by the Control Tower (assets/ct/journey-view.js), never by the engine. say: {n} is the fact named by count. demo.facts are merged into the new-store demo's facts when its demo button is pressed. flow names a module the tower opens for the step (store-activation: its own modal); action is the step's button; cheer is what the assistant says over it."
  },
  "nodes": [
    { "id": "setup", "type": "chapter", "label": "Set up your store",
      "payload": { "line": "Let's get your store ready", "pins": ["products", "customers"], "event": "store.active",
                   "announce": { "on": "done", "title": "Your store is ready", "line": "Orders is open: take an order in two taps and send the invoice on WhatsApp.", "button": "Take your first order", "open": "order" } },
      "done": { "all": [ { "node": "products.fixed", "is": "done" }, { "node": "customers.fixed", "is": "done" } ] } },

    { "id": "products", "type": "area", "parent": "setup", "label": "Products", "payload": { "area": "products" } },
    { "id": "products.added", "type": "stage", "parent": "products", "label": "Added",
      "payload": { "stage": "added", "ask": "Add your products", "how": "Drop your rate list or item master. Any XLSX or CSV works; I read it and lay it out like a sheet.", "cheer": "Let's fill your shelf first. Bring the file you already have.", "action": "Add your products", "flow": { "module": "store-activation", "step": "items", "mode": "setup" }, 
                   "screen": { "route": "#/product-master/finished-goods", "label": "Product Master" },
                   "demo": { "label": "Add 42 sample products", "facts": { "products": { "count": 42, "broken": 3, "incomplete": 8 } } } },
      "done": { "fact": "products.count", "gte": 1 } },
    { "id": "products.fixed", "type": "stage", "parent": "products", "label": "Fixed", "requires": ["products.added"],
      "payload": { "stage": "fixed", "ask": "Fix the products that would break an order", "count": "products.broken", "say": "{n} still need a fix", "how": "Red cells first. One tap answers most of them.", "cheer": "Almost there. Fix the red cells and your products are ready to sell.", "action": "Review your products", "flow": { "module": "store-activation", "step": "items", "mode": "setup" }, 
                   "reward": { "freeDays": 1 }, "screen": { "route": "#/product-master/finished-goods", "label": "Product Master" },
                   "demo": { "label": "Fix the 3 products", "facts": { "products": { "broken": 0 } } } },
      "done": { "all": [ { "fact": "products.count", "gte": 1 }, { "fact": "products.broken", "eq": 0 } ] } },
    { "id": "products.complete", "type": "stage", "parent": "products", "label": "Complete", "requires": ["products.fixed"], "optional": true,
      "payload": { "stage": "complete", "ask": "Add the MRP so Inventory can value your stock", "count": "products.incomplete", "say": "{n} have no MRP",
                   "opens": "inventory", "reward": { "freeDays": 1 }, "screen": { "route": "#/product-master/finished-goods", "label": "Product Master" },
                   "demo": { "label": "Add the missing MRPs", "facts": { "products": { "incomplete": 0 } } } },
      "done": { "all": [ { "fact": "products.count", "gte": 1 }, { "fact": "products.incomplete", "eq": 0 } ] } },

    { "id": "customers", "type": "area", "parent": "setup", "label": "Customers", "requires": ["products.added"],
      "payload": { "area": "customers", "locked": "after your first product",
                   "announce": { "on": "available", "title": "Customers is open", "line": "Add the shops you sell to, straight from your phone contacts.", "button": "Add your customers", "open": "customers" } } },
    { "id": "customers.added", "type": "stage", "parent": "customers", "label": "Added",
      "payload": { "stage": "added", "ask": "Add your customers", "how": "Drop your customer list. Any XLSX or CSV works; names and phone numbers are enough.", "cheer": "Now the shops you sell to. A list with names and numbers is enough.", "action": "Add your customers", "flow": { "module": "store-activation", "step": "customers", "mode": "setup" }, 
                   "screen": { "route": "#/customer-management/b2b-customers", "label": "B2B Customers" },
                   "demo": { "label": "Add 18 sample customers", "facts": { "customers": { "count": 18, "broken": 2, "incomplete": 12 } } } },
      "done": { "fact": "customers.count", "gte": 1 } },
    { "id": "customers.fixed", "type": "stage", "parent": "customers", "label": "Fixed", "requires": ["customers.added"],
      "payload": { "stage": "fixed", "ask": "Fix the customers that can't be reached", "count": "customers.broken", "say": "{n} still need a fix", "how": "Every customer needs a name and a phone that works.", "cheer": "One more push. Fix these and your store is ready for orders.", "action": "Review your customers", "flow": { "module": "store-activation", "step": "customers", "mode": "setup" }, 
                   "reward": { "freeDays": 1 }, "screen": { "route": "#/customer-management/b2b-customers", "label": "B2B Customers" },
                   "demo": { "label": "Fix the 2 phone numbers", "facts": { "customers": { "broken": 0 } } } },
      "done": { "all": [ { "fact": "customers.count", "gte": 1 }, { "fact": "customers.broken", "eq": 0 } ] } },
    { "id": "customers.complete", "type": "stage", "parent": "customers", "label": "Complete", "requires": ["customers.fixed"], "optional": true,
      "payload": { "stage": "complete", "ask": "Pin where each customer is, for Deliveries", "count": "customers.incomplete", "say": "{n} have no delivery pin",
                   "opens": "deliveries", "reward": { "freeDays": 1 }, "screen": { "route": "#/customer-management/b2b-customers", "label": "B2B Customers" },
                   "demo": { "label": "Pin the 12 customers", "facts": { "customers": { "incomplete": 0 } } } },
      "done": { "all": [ { "fact": "customers.count", "gte": 1 }, { "fact": "customers.incomplete", "eq": 0 } ] } },

    { "id": "first-orders", "type": "chapter", "label": "Take your first orders", "requires": ["setup"],
      "payload": { "line": "Your store is ready · take your first order", "pins": ["order", "customers"] } },
    { "id": "order", "type": "area", "parent": "first-orders", "label": "Orders", "payload": { "area": "order", "locked": "when your store is ready" } },
    { "id": "order.first", "type": "stage", "parent": "order", "label": "First order", "sticky": true,
      "payload": { "stage": "added", "ask": "Take your first order", "how": "Tap a customer, then tap + on what they want", "reward": { "freeDays": 2 },
                   "screen": { "route": "#/sales-orders", "label": "Sales Orders" },
                   "demo": { "label": "Take a sample order", "facts": { "orders": { "count": 1, "days": 1 } } } },
      "done": { "fact": "orders.count", "gte": 1 } },
    { "id": "order.sent", "type": "stage", "parent": "order", "label": "Invoice sent", "requires": ["order.first"],
      "payload": { "stage": "fixed", "ask": "Send the invoice to your customer on WhatsApp", "screen": { "route": "#/sales-orders", "label": "Sales Orders" },
                   "demo": { "label": "Send its invoice", "facts": { "orders": { "sent": 1 } } } },
      "done": { "fact": "orders.sent", "gte": 1 } },
    { "id": "order.rhythm", "type": "stage", "parent": "order", "label": "Orders on 3 days", "requires": ["order.first"],
      "payload": { "stage": "complete", "ask": "Take orders on 3 different days", "count": "orders.days", "say": "Orders on {n} of 3 days", "live": "order",
                   "screen": { "route": "#/sales-orders", "label": "Sales Orders" },
                   "demo": { "label": "Take orders on 3 days", "facts": { "orders": { "count": 4, "days": 3, "sent": 4 } } } },
      "done": { "fact": "orders.days", "gte": 3 } },

    { "id": "run-day", "type": "chapter", "label": "Run your day", "requires": ["order.first"],
      "payload": { "line": "First order in · deliver it and get paid", "pins": ["deliveries", "collections"],
                   "announce": { "on": "available", "title": "Your first order is in", "line": "Deliveries and Collections are open: deliver it and get paid.", "button": "Record the delivery", "open": "deliveries" } } },
    { "id": "deliveries", "type": "area", "parent": "run-day", "label": "Deliveries", "payload": { "area": "deliveries", "locked": "after your first order" } },
    { "id": "deliveries.first", "type": "stage", "parent": "deliveries", "label": "First delivery", "sticky": true,
      "payload": { "stage": "added", "ask": "Record your first delivery", "reward": { "freeDays": 2 },
                   "screen": { "route": "#/distribution-logistics/delivery-management", "label": "Delivery Management" },
                   "demo": { "label": "Record a sample delivery", "facts": { "deliveries": { "count": 1 } } } },
      "done": { "fact": "deliveries.count", "gte": 1 } },
    { "id": "deliveries.van", "type": "stage", "parent": "deliveries", "label": "Van and driver", "requires": ["deliveries.first"],
      "payload": { "stage": "fixed", "ask": "Name your van and driver", "screen": { "route": "#/distribution-logistics/route-planning", "label": "Route Planning" },
                   "demo": { "label": "Add Van 1 and its driver", "facts": { "deliveries": { "vans": 1 } } } },
      "done": { "fact": "deliveries.vans", "gte": 1 } },
    { "id": "deliveries.day", "type": "stage", "parent": "deliveries", "label": "A day closed", "requires": ["deliveries.van"],
      "payload": { "stage": "complete", "ask": "Close a full day's route", "live": "deliveries",